derived_word,origin_w,chapter,deck,meaning,example,viewed,status
Donate,grant,4,2,"Give (money or goods) for a good cause, for example to a charity.",An anonymous businesswoman donated one million dollars to the charity.,0,0
Empower,grant,4,2,Give (someone) the authority or power to do something.,This amendment empowers the president to declare an emergency for a wide range of reasons.,0,0
Pension,grant,4,2,A regular payment made by the state to people of or above the official retirement age and to some widows and disabled people.,a government pension,0,0
Eminent,outstanding,4,2,(of a person) famous and respected within a particular sphere.,an eminent historian,0,0
Excellent,outstanding,4,2,Extremely good; outstanding.,The food was excellent.,0,0
Leonine,outstanding,4,2,Of or resembling a lion or lions.,"Say so, the lion, should have leonine vivid law and look.",0,0
Magnificent,outstanding,4,2,"Extremely beautiful, elaborate, or impressive.",a magnificent view,0,0
Paramount,outstanding,4,2,More important than anything else; supreme.,"There are many priorities, but reducing the budget deficit is paramount/is of paramount importance.",0,0
Principal,outstanding,4,2,First in order of importance; main.,Iraq's principal export is oil.,0,0
Prominent,outstanding,4,2,Important; famous.,a prominent Democrat,0,0
Sterling,outstanding,4,2,British money.,The value of sterling increased against several other currencies yesterday.,0,0
Successful,outstanding,4,2,Accomplishing a desired aim or result.,a successful operation,0,0
Superb,outstanding,4,2,Very good; excellent.,He is a superb dancer.,0,0
Superlative,outstanding,4,2,Of the highest quality or degree.,"""Richest"" is the superlative of "" rich "".",0,0
Exemplary,outstanding,4,2,Serving as a desirable model; very good.,"His tact was exemplary, especially considering the circumstances.",0,0
Preferable,outstanding,4,2,More desirable or suitable.,Surely a diplomatic solution is preferable to war.,0,0
Magician,outstanding,4,2,A person with magical powers.,Merlin was the magician in the stories of King Arthur and the Knights of the Round Table.,0,0
Marvel,outstanding,4,2,Be filled with wonder or astonishment.,We paused to marvel at the view.,0,0
Necromancer,outstanding,4,2,A person who practises necromancy; a wizard or magician.,Leonardo da Vinci was thought to be a necromancer due to his extensive knowledge of human anatomy and his study dead bodies.,0,0
Prodigy,outstanding,4,2,A young person with exceptional qualities or abilities.,The 16-year-old tennis prodigy is the youngest player ever to reach the Olympic finals.,0,0
Prowess,outstanding,4,2,Skill or expertise in a particular activity or field.,athletic / sporting prowess,0,0
Glorious,outstanding,4,2,"Having, worthy of, or bringing fame or admiration.",a glorious victory,0,0
Grandiose,outstanding,4,2,"Impressive and imposing in appearance or style, especially pretentiously so.",grandiose schemes / designs ideas for making money,0,0
Ornate,outstanding,4,2,Elaborately or highly decorated.,a room with an ornate ceiling and gold mirrors,0,0
Palatial,outstanding,4,2,Resembling a palace in being spacious and splendid.,They lived in a palatial apartment.,0,0
Resplendent,outstanding,4,2,Attractive and impressive through being richly colourful or sumptuous.,the queen's resplendent purple robes,0,0
Sumptuous,outstanding,4,2,Splendid and expensive-looking.,The celebrity guests turned up dressed in sumptuous evening gowns.,0,0
Incomparable,outstanding,4,2,Without an equal in quality or extent; matchless.,incomparable beauty / skill,0,0
Deplorable,hate,4,3,Deserving strong condemnation; completely unacceptable.,I thought his behaviour was absolutely deplorable.,0,0
Formidable,hate,4,3,"Inspiring fear or respect through being impressively large, powerful, intense, or capable.",a formidable obstacle / task,0,0
Inhuman,hate,4,3,Lacking human qualities of compassion and mercy; cruel and barbaric.,Prisoners of war were subjected to inhuman and degrading treatment.,0,0
Intolerant,hate,4,3,"Not tolerant of views, beliefs, or behaviour that differ from one's own.",She can be very intolerant of students who don't understand what she's talking about.,0,0
obnoxious,hate,4,3,Extremely unpleasant.,Some of his colleagues say that he's loud and obnoxious.,0,0
Resent,hate,4,3,"Feel bitterness or indignation at (a circumstance, action, or person)",She bitterly resented her father's new wife.,0,0
Loathe,hate,4,3,Feel intense dislike or disgust for.,From an early age the brothers have loathed each other.,0,0
Detest,hate,4,3,Dislike intensely.,I detest any kind of cruelty.,0,0
Acrimony,hate,4,3,Bitterness or ill feeling.,an acrimonious dispute,0,0
Animosity,hate,4,3,Strong hostility.,"Of course we're competitive, but there's no personal animosity between us.",0,0
Cynicism,hate,4,3,An inclination to believe that people are motivated purely by self-interest; scepticism.,She has a pretty cynical view of men.,0,0
Enmity,hate,4,3,A state or feeling of active opposition or hostility.,She denied any personal enmity towards him.,0,0
Hostility,hate,4,3,Hostile behaviour; unfriendliness or opposition.,a hostile crowd,0,0
Misanthropy,hate,4,3,A dislike of humankind.,"In much of his work there is a sour, disappointed misanthropy.",0,0
Sarcasm,hate,4,3,The use of irony to mock or convey contempt.,"""You have been working hard,"" he said with heavy sarcasm, as he looked at the empty page.",0,0
Venom,hate,4,3,a poisonous substance secreted by animals.,He was shocked at the sheer venom of her reply.,0,0
Cogent,forceful,4,3,"(of an argument or case) clear, logical, and convincing.",She argued most cogently for a relaxation of the sanctions.,0,0
Decisive,forceful,4,3,Settling an issue; producing a definite result.,You need to be more decisive.,0,0
Drastic,forceful,4,3,Likely to have a strong or far-reaching effect; radical and extreme.,drastic measures,0,0
Effective,forceful,4,3,Successful in producing a desired or intended result.,It's an extremely effective cure for a headache.,0,0
Eloquent,forceful,4,3,Fluent or persuasive in speaking or writing.,She made an eloquent appeal for action.,0,0
Emphatic,forceful,4,3,Expressing something forcibly and clearly.,Poland reached the final of the championship yesterday with an emphatic 50 victory over Italy.,0,0
Enthusiastic,forceful,4,3,"Having or showing intense and eager enjoyment, interest, or approval.",One of the good things about teaching young children is their enthusiasm.,0,0
Forcible,forceful,4,3,Done by force.,The police's forcible entry into the building has come under a lot of criticism.,0,0
Insistent,forceful,4,3,Insisting on or demanding something; not allowing refusal.,Greg still insists (that) he did nothing wrong.,0,0
Stringent,forceful,4,3,"(of regulations, requirements, or conditions) strict, precise, and exacting.",The most stringent laws in the world are useless unless there is the will to enforce them.,0,0
Tenacious,forceful,4,3,Tending to keep a firm hold of something; clinging or adhering closely.,The baby took my finger in its tenacious little fist.,0,0
Vehement,forceful,4,3,"Showing strong feeling; forceful, passionate, or intense.","Despite vehement opposition from his family, he quit school and became an actor.",0,0
Virile,forceful,4,3,"(of a man) having strength, energy, and a strong sex drive.",She likes her men young and virile.,0,0
Dominant,forceful,4,3,Having power and influence over others.,a dominant military power,0,0
Irresistible,forceful,4,3,Too attractive and tempting to be resisted.,an irresistible offer,0,0
Significant,forceful,4,3,Sufficiently great or important to be worthy of attention; noteworthy.,There has been a significant increase in the number of women students in recent years.,0,0
Collapse,failure,4,3,(of a structure) suddenly fall down or give way.,Thousands of buildings collapsed in the earthquake.,0,0
Deficiency,failure,4,3,A lack or shortage.,Pregnant women often suffer from iron deficiency.,0,0
Demise,failure,4,3,A person's death.,The demise of the company was sudden and unexpected.,0,0
Fiasco,failure,4,3,"A complete failure, especially a ludicrous or humiliating one.",The show was a fiasco - one actor forgot his lines and another fell off the stage.,0,0
Negligence,failure,4,3,Failure to take proper care over something.,medical negligence,0,0
Constellation,system,5,1,A group of stars forming a pattern that is traditionally named after its apparent form or identified with a mythological figure.,At our annual ceremony we had a whole constellation of movie stars and directors.,0,0
Course,system,5,1,"The route or direction followed by a ship, aircraft, road, or river.",They're going away on a training course next week.,0,0
Machinery,system,5,1,Machines collectively.,industrial / farm machinery,0,0
Metaphysics,system,5,1,abstract theory with no basis in reality., All students receive tuition in logic and metaphysics.,0,0
Morphology,system,5,1,The study of the forms of things.,The morphology of the system was simplified in a manner suited to the recognition task.,0,0
Network,system,5,1,An arrangement of intersecting horizontal and vertical lines.,a television network,0,0
Philosophy,system,5,1,"The study of the fundamental nature of knowledge, reality, and existence, especially when considered as an academic discipline.",Ren Descartes is regarded as the founder of modern philosophy.,0,0
Rationalism,system,5,1,The practice or principle of basing opinions and actions on reason and knowledge.,"Viewed through the lens of material rationalism, this was a clear improvement.",0,0
Regime,system,5,1,"A government, especially an authoritarian one.","The old corrupt, totalitarian regime was overthrown.",0,0
Resource,system,5,1,"A stock or supply of money, materials, staff, and other assets that can be drawn on to function effectively.",The country's greatest resource is the dedication of its workers.,0,0
Technic,system,5,1,Technique.,The change of computer technic has caught many employees off guard.,0,0
Technique,system,5,1,"A way of carrying out a particular task, especially the execution or performance of an artistic work or a scientific procedure.",We have developed a new technique for detecting errors in the manufacturing process.,0,0
Effect,develop,5,1,A change which is a result or consequence of an action or other cause.,The radiation leak has had a disastrous effect on/upon the environment.,0,0
Emergence,develop,5,1,The process of becoming visible after being concealed.,"She emerged from the sea, blue with cold.",0,0
Expansion,develop,5,1,The action of becoming larger or more extensive.,The air in the balloon expands when heated.,0,0
Extension,develop,5,1,A part that is added to something to enlarge or prolong it.,"Martin Luther King, Jr, campaigned for the extension of civil rights to black people.",0,0
Formation,develop,5,1,The action of forming or process of being formed.,a rock formation,0,0
Preferment,develop,5,1,Promotion or appointment to a position or office.,"Not only does he bring the wisdom and good sense of years to his job, he is old enough not to be looking for any preferment.",0,0
Transition,develop,5,1,The process or a period of changing from one state or condition to another.,The health-care system is in transition at the moment.,0,0
Conversion,develop,5,1,The process of changing or causing something to change from one form to another.,Solar power is the conversion of the sun's energy into heat and electricity.,0,0
Sentience,develop,5,1,"the capacity to feel, perceive or experience subjectively",Why are humans not willing to accept the full sentience of other animals ?,0,0
Alter,develop,5,1,"Change in character or composition, typically in a comparatively small but significant way.",We've had to alter some of our plans.,0,0
Augment,develop,5,1,Make (something) greater by adding to it; increase.,He would have to find work to augment his income.,0,0
Consolidate,develop,5,1,Make (something) physically stronger or more solid.,The success of their major product consolidated the firm's position in the market.,0,0
Derive,develop,5,1,Obtain something from (a specified source),The institute derives all its money from foreign investments.,0,0
Emerge,develop,5,1,Move out of or away from something and become visible.,"She emerged from the sea, blue with cold.",0,0
Expand,develop,5,1,Become or make larger or more extensive.,The air in the balloon expands when heated.,0,0
Evolve,develop,5,1,Develop gradually.,Did humans evolve from apes ?,0,0
Revise,develop,5,1,Examine and make corrections or alterations to (written or printed matter),His helpfulness today has made me revise my original opinion / impression of him.,0,0
Acknowledgment,admission,5,1,Acceptance of the truth or existence of something.,All I want is some acknowledgment that his behaviour is unreasonable.,0,0
Apology,admission,5,1,A regretful acknowledgement of an offence or failure.,I have an apology to make to you - I'm afraid I opened your letter by mistake.,0,0
Entree,admission,5,1,The main course of a meal.,She had an entree into the city's culti-vated society.,0,0
Importation,admission,5,1,The bringing of goods or services into a country from abroad for sale.,We import a large number of cars from Japan.,0,0
Introgression,admission,5,1,The transfer of genetic information from one species to another as a result of hybridization between them., One of the main trends of lily breeding is to realize introgression between these groups.,0,0
Embark,admission,5,1,Go on board a ship or aircraft.,We embarked at Liverpool for New York.,0,0
Adversity,calamity,5,2,A difficult or unpleasant situation.,She was always cheerful in adversity.,0,0
Calvary,calamity,5,2,The hill outside Jerusalem on which Christ was crucified.,The Plaza Mayor is dominated by a calvary.,0,0
Casualty,calamity,5,2,A person killed or injured in a war or accident.,"The train was derailed but there were no casualties, police said.",0,0
Cataclysm,calamity,5,2,A large-scale and violent event in the natural world.,These countries are on the brink of cataclysmic famine.,0,0
Catastrophe,calamity,5,2,An event causing great and usually sudden damage or suffering; a disaster.,They were warned of the ecological catastrophe to come.,0,0
Havoc,calamity,5,2,Widespread destruction.,"The storm wreaked havoc in the garden, uprooting trees and blowing a fence down.",0,0
Mishap,calamity,5,2,An unlucky accident.,The parade was very well organized and passed without mishap.,0,0
Ordeal,calamity,5,2,A very unpleasant and prolonged experience.,The hostages  ordeal came to an end when soldiers stormed the building.,0,0
Upheaval,calamity,5,2,A violent or sudden change or disruption to something.,Yesterday's coup brought further upheaval to a country already struggling with famine.,0,0
Avalanche,deluge,5,2,"A mass of snow, ice, and rocks falling rapidly down a mountainside.",We were swamped by an avalanche of letters / phone calls complaints.,0,0
Inundate,deluge,5,2,Overwhelm (someone) with things or people to be dealt with.,We have been inundated with requests for help.,0,0
Overproduction,deluge,5,2,"Production of more of a product, commodity, or substance than is wanted or needed.","Farmers are being encouraged to diversify into other crops, rather than continue to overproduce wine.",0,0
Submerge,deluge,5,2,Cause (something) to be under water.,The submarine submerged when enemy planes were sighted.,0,0
Submergence,deluge,5,2,The process or state of being submerged in or covered with water.,An ample water supply is probably the greatest advantage of soil submergence for irrigated rice.,0,0
Submersion,deluge,5,2,The action or state of submerging or being submerged.,The fruit was preserved by submersion in alcohol.,0,0
Abominable,bad,5,2,Causing moral revulsion.,The prisoners are forced to live in abominable conditions.,0,0
Contemptible,bad,5,2,Deserving contempt; despicable.,Her behaviour was contemptible.,0,0
Despicable,bad,5,2,Deserving hatred and contempt.,despicable behaviour,0,0
Disreputable,bad,5,2,Not considered to be respectable in character or appearance.,Some of the more disreputable newspapers made FALSE claims about her private life.,0,0
Lewd,bad,5,2,Crude and offensive in a sexual way.,Ignore him - he's being lewd.,0,0
Odious,bad,5,2,Extremely unpleasant; repulsive.,an odious crime,0,0
Repugnant,bad,5,2,Extremely distasteful; unacceptable.,a repugnant smell,0,0
Repulsive,bad,5,2,Arousing intense distaste or disgust.,What a repulsive old man!,0,0
Sordid,bad,5,2,Involving immoral or dishonourable actions and motives; arousing moral distaste and contempt.,There are lots of really sordid apartments in the city's poorer areas.,0,0
Contaminate,bad,5,2,Make (something) impure by exposure to or addition of a poisonous or polluting substance.,Much of the coast has been contaminated by nuclear waste.,0,0
Dishonest,bad,5,2,"Behaving or prone to behave in an untrustworthy, deceitful, or insincere way.",a dishonest lawyer,0,0
Immoral,bad,5,2,Not conforming to accepted standards of morality.,an immoral act,0,0
Sophisticate,bad,5,2,Make (someone or something) more sophisticated.,They are cheating but are sophisticated enough to avoid detection.,0,0
Subvert,bad,5,2,Undermine the power and authority of (an established system or institution),subversive elements / groups in society,0,0
Lascivious,bad,5,2,Feeling or revealing an overt sexual interest or desire.,a lascivious smile,0,0
Sacrilegious,bad,5,2,Involving or committing sacrilege.,Muslims consider it sacrilege to wear shoes inside a mosque.,0,0
Salacious,bad,5,2,Having or conveying undue or inappropriate interest in sexual matters.,a salacious book / joke comment,0,0
Venal,bad,5,2,Showing or motivated by susceptibility to bribery; corrupt.,a venal ruler,0,0
Admonish,criticize,5,3,Reprimand firmly.,His mother admonished him for eat ing too quickly.,0,0
Castigate,criticize,5,3,Reprimand (someone) severely.,Health inspectors castigated the kitchen staff for poor standards of cleanliness.,0,0
Chastise,criticize,5,3,Rebuke or reprimand severely.,Charity organizations have chastised the government for not do ing enough to prevent the latest famine in Africa.,0,0
Denounce,criticize,5,3,Publicly declare to be wrong or evil.,The government's economic policy has been denounced on all sides.,0,0
Denunciation,criticize,5,3,Public condemnation of someone or something.,his denunciation as a traitor,0,0
Indict,criticize,5,3,Formally accuse of or charge with a crime.,He was indicted on drug charges at Snaresbrook Crown Court.,0,0
Chronology,criticize,5,3,The arrangement of events or dates in the order of their occurrence.,I'm not sure of the chronology of events.,0,0
Commentary,criticize,5,3,An expression of opinions or offering of explanations about an event or situation.,The commentary on the Olympic Games was much better on the other channel.,0,0
Discussion,criticize,5,3,The action or process of talking about something in order to reach a decision or to exchange ideas.,We will discussions with employee representatives about possible redundancies.,0,0
Editorial,criticize,5,3,Relating to the commissioning or preparing of material for publication.,All the papers deal with the same subject in their editorials.,0,0
Reconsider,criticize,5,3,"Consider (something) again, especially for a possible change of decision regarding it.",He begged her to reconsider but she would not.,0,0
Revisal,criticize,5,3,the act of revising; revision," From the raising of the hypothesis to revisal, the pattern becomes the inherent logic of the innovation to theory of Physics.",0,0
Gullible,foolish,5,3,Easily persuaded to believe something; credulous.,There are any number of miracle cures on the market for people gullible enough to buy them.,0,0
Imprudent,foolish,5,3,Not showing care for the consequences of an action; rash.,The report criticizes the banks for being imprudent in their lending.,0,0
Quixotic,foolish,5,3,Extremely idealistic; unrealistic and impractical.,"This is a vast, exciting and some say quixotic project.",0,0
Unwise,foolish,5,3,(of a person or action) not wise or sensible; foolish.,We made several unwise investments and lost quite a bit of money.,0,0
Absurd,foolish,5,3,"Wildly unreasonable, illogical, or inappropriate.",What an absurd thing to say!,0,0
Arbitrary,foolish,5,3,"Based on random choice or personal whim, rather than any reason or system.",arbitrary decision-making,0,0
Illogical,foolish,5,3,"Lacking sense or clear, sound reasoning.","It is an illogical statement, because if one part is TRUE, then the other must be FALSE.",0,0
Inadmissible,foolish,5,3,(especially of evidence in court) not accepted as valid.,Her confession was ruled inadmissible as evidence because it was given under pressure from the police.,0,0
Invalid,foolish,5,3,A person made weak or disabled by illness or injury.,I'm afraid your driving licence is invalid in Eastern Europe.,0,0
Undue,foolish,5,3,Unwarranted or inappropriate because excessive or disproportionate.,Such a high increase will impose an undue burden on the local tax payer.,0,0
Lunacy,foolish,5,3,The state of being a lunatic; insanity (not in technical use),It would be lunacy to try to climb the mountain in this weather.,0,0
Incoherent,foolish,5,3,(of spoken or written language) expressed in an incomprehensible or confusing way; unclear.,He was confused and incoherent and I didn't get much sense out of him.,0,0
Comical,foolish,5,3,"Amusing, especially in a ludicrous or absurd way.",He looked so comical in that hat.,0,0
Futile,Small/Trivial,5,3,Incapable of producing any useful result; pointless.,Attempts to get supplies to the region are futile because troops will not allow the aid convoy to enter city.,0,0
Immaterial,Small/Trivial,5,3,Unimportant under the circumstances; irrelevant.,Whether the book is well or badly written is immaterial ( to me) - it has an important message.,0,0
Inconsequential,Small/Trivial,5,3,Not important or significant.,an inconsequential matter / remark,0,0
Insignificant,Small/Trivial,5,3,Too small or unimportant to be worth consideration.,Why bother arguing about such an insignificant amount of money ?,0,0
Irrelevant,Small/Trivial,5,3,Not connected with or relevant to something.,These documents are largely irrelevant to the present investigation.,0,0
Negligible,Small/Trivial,5,3,So small or unimportant as to be not worth considering; insignificant.,The difference between the two products is negligible.,0,0
Secondary,Small/Trivial,5,3,"Coming after, less important than, or resulting from someone or something else that is primary.",Her health is what matters - the cost of the treatment is of secondary importance.,0,0
Slight,Small/Trivial,5,3,Small in degree; inconsiderable.,a slight improvement,0,0
Superficial,Small/Trivial,5,3,Existing or occurring at or on the surface.,"He's fun to be with, but he's very superficial.",0,0
Imperceptible,Small/Trivial,5,3,"So slight, gradual, or subtle as not to be perceived.","She heard a faint, almost imperceptible cry.",0,0
Pitiful,Small/Trivial,5,3,Deserving or arousing pity.,The refugees arriving at the camp had pitiful stories to tell.,0,0
Trivial,Small/Trivial,5,3,Of little value or importance.,I don't know why he gets so upset about something so trivial.,0,0
Condense,Small/Trivial,5,3,Make (something) denser or more concentrated.,I condensed ten pages of comments into/to two.,0,0
Miniature,Small/Trivial,5,3,Very small of its kind.,I bought some miniature furniture for my niece's doll's house.,0,0
Miter,Small/Trivial,5,3,miniature; the official headdress of a bishop in the Western Church,He covered the miter with glue before making the joint.,0,0
Brusque,rude,6,1,Abrupt or offhand in speech or manner.,His secretary was a little brusque with me.,0,0
Candid,rude,6,1,Truthful and straightforward; frank.,The two presidents have had candid talks about the current crisis.,0,0
Forthright,rude,6,1,(of a person or their manner or speech) direct and outspoken.,His forthright manner can be mistaken for rudeness.,0,0
Succinct,rude,6,1,(especially of something written or spoken) briefly and clearly expressed.,Keep your letter succinct and to the point.,0,0
Undermine,rude,6,1,Erode the base or foundation of (a rock formation),The president has accused two cabinet members of working secretly to undermine his position /him.,0,0
Abusive,rude,6,1,Extremely offensive and insulting.,an abusive letter / phone call,0,0
Boorish,rude,6,1,Rough and bad-mannered; coarse.,I found him rather boorish and aggressive.,0,0
Crass,rude,6,1,Showing no intelligence or sensitivity.,a crass remark,0,0
Flippant,rude,6,1,Not showing a serious or respectful attitude.,a flippant remark / attitude,0,0
Irreverent,rude,6,1,Showing a lack of respect for people or things that are generally taken seriously.,an irreverent comment / approach attitude,0,0
Irreverential,rude,6,1,lacking in due respect or reverence,Journalists may undermine the establishment's power in ways which are sometimes irreverential.,0,0
Mischievous,rude,6,1,Causing or showing a fondness for causing trouble in a playful way.,She has a mischievous sense of humour.,0,0
Presumptuous,rude,6,1,(of a person or their behaviour) failing to observe the limits of what is permitted or appropriate.,It would be presumptuous of me to comment on the matter.,0,0
Hoarse,rude,6,1,"(of a person's voice) sounding rough and harsh, typically as the result of a sore throat or of shouting.",All the shouting had left her rather hoarse.,0,0
Onerous,rude,6,1,"(of a task or responsibility) involving a great deal of effort, trouble, or difficulty.",the onerous task of finding a peaceful solution,0,0
Raucous,rude,6,1,Making or constituting a disturbingly harsh and loud noise.,I heard the raucous call of the crows.,0,0
Savage,rude,6,1,"(of an animal or force of nature) fierce, violent, and uncontrolled.",a savage dog / beast,0,0
