derived_word,origin_w,chapter,deck,meaning,example,viewed,status
Subterfuge,cheat,2,3,Deceit used in order to achieve one's goal.,It was clear that they must have obtained the information by subterfuge.,0,0
Innocuous,banal,2,3,Not harmful or offensive.,Some mushrooms look innocuous but are in fact poisonous.,0,0
Insipid,banal,2,3,Lacking flavour; weak or tasteless.,a pale insipid wine,0,0
Mundane,banal,2,3,Lacking interest or excitement; dull.,Mundane matters such as paying bills and shopping for food do not interest her.,0,0
Pedestrian,banal,2,3,A person walking rather than travelling in a vehicle.,A few pedestrians sheltered from the rain in doorways.,0,0
Prosaic,banal,2,3,Having or using the style or diction of prose as opposed to poetry; lacking imaginativeness or originality.,If only she'd been called Camilla or Flavia instead of the prosaic Jane.,0,0
Antagonism,disagreement,2,3,Active hostility or opposition.,There's a history of antagonism between the two teams.,0,0
Contradiction,disagreement,2,3,"A combination of statements, ideas, or features which are opposed to one another.",You say that you're good friends and yet you don't trust him. Isn't that a contradiction?,0,0
Dissension,disagreement,2,3,Disagreement that leads to discord.,There are signs of dissension within the ruling political party.,0,0
Skirmish,disagreement,2,3,"An episode of irregular or unpremeditated fighting, especially between small or outlying parts of armies or fleets.",There was a short skirmish between the two of them over who would pay for the meal.,0,0
Squabble,disagreement,2,3,A noisy quarrel about something trivial.,Polly and Susie were having a squabble about who was going to hold the dog's lead.,0,0
Wrangle,disagreement,2,3,"A dispute or argument, typically one that is long and complicated.",a lengthy wrangle about/over costs,0,0
Aversion,disagreement,2,3,A strong dislike or disinclination.,I felt an instant aversion to his parents.,0,0
Prejudice,disagreement,2,3,Preconceived opinion that is not based on reason or actual experience.,Laws against racial prejudice must be strictly enforced.,0,0
Rancor,disagreement,2,3,"Bitterness or resentfulness, especially when long standing.",Can we settle this disagreement without rancor?,0,0
Adverse,disagreement,2,3,Preventing success or development; harmful; unfavourable.,The match has been cancelled because of adverse.,0,0
Contradictory,disagreement,2,3,Mutually opposed or inconsistent.,I keep getting contradictory advice - some people tell me to it warm and some me to put ice on it.,0,0
Dissent,disagreement,2,3,The holding or expression of opinions at variance with those commonly or officially held.,"When the time came to approve the proposal, there were one or two dissent.",0,0
Outcry,disagreement,2,3,An exclamation or shout.,The release from prison of two of the terrorists has provoked a public outcry.,0,0
Query,disagreement,2,3,"A question, especially one expressing doubt or requesting information.","If you have any queries about your treatment, the doctor will answer them.",0,0
Reluctance,disagreement,2,3,Unwillingness or disinclination to do something.,I accepted his resignation with great reluctance.,0,0
Decency,virtue,3,1,Behaviour that conforms to accepted standards of morality or respectability.,a sense of decency,0,0
Differentia,virtue,3,1,A distinguishing mark or characteristic.,"If one of them only has this differentia, then this one is composite and is not the first cause.",0,0
Efficacy,virtue,3,1,The ability to produce a desired or intended result.,They recently ran a series of tests to measure the efficacy of the drug.,0,0
Excellence,virtue,3,1,The quality of being outstanding or extremely good.,The school is noted for its academic excellence.,0,0
Excellency,virtue,3,1,"A title or form of address given to certain high officials of state, especially ambassadors, or of the Roman Catholic Church.",His Excellency will be pleased to see you now.,0,0
Integrity,virtue,3,1,The quality of being honest and having strong moral principles.,No one doubted that the president was a man of the highest integrity.,0,0
Morality,virtue,3,1,Principles concerning the distinction between right and wrong or good and bad behaviour.,They argued for a new morality based on self-sacrifice and honesty.,0,0
Prudery,virtue,3,1,The state of being asily shocked by matters relating to sex or nudity,the prudishness of Victorian Britain,0,0
Trait,virtue,3,1,"A distinguishing quality or characteristic, typically one belonging to a person.",His sense of humour is one of his better traits.,0,0
Probity,virtue,3,1,The quality of having strong moral principles; honesty and decency.,Her probity and integrity are beyond question.,0,0
Propriety,virtue,3,1,Conformity to conventionally accepted standards of behaviour or morals.,The director insisted that there was no question as to the propriety of how the funds were raised.,0,0
Righteousness,virtue,3,1,The quality of being morally right or justifiable.,He was regarded as a righteous and holy man.,0,0
Veracity,virtue,3,1,Conformity to facts; accuracy.,Doubts were cast on the veracity of her alibi.,0,0
Rectitude,virtue,3,1,Morally correct behaviour or thinking; righteousness.,"An austere man of unquestioned moral rectitude, Nava inspired deep devotion in those who worked for him.",0,0
Criterion,virtue,3,1,A principle or standard by which something may be judged or decided.,The Health Service should not be judged by financial criteria alone.,0,0
Dialogue,discourse,3,1,"A conversation between two or more people as a feature of a book, play, or film.",The play contained some very snappy / witty dialogue.,0,0
Harangue,discourse,3,1,A lengthy and aggressive speech.,A drunk in the station was haranguing passers-by.,0,0
Monologue,discourse,3,1,"A long speech by one actor in a play or film, or as part of a theatrical or broadcast programme.",He subjected me to a monologue on his last stay in hospital.,0,0
Soliloquy,discourse,3,1,"An act of speaking one's thoughts aloud when by oneself or regardless of any hearers, especially by a character in a play.","Hamlet's soliloquy starts ""To be or not to be"".",0,0
Treatise,discourse,3,1,A written work dealing formally and systematically with a subject.,a six-volume treatise on trademark law,0,0
Dormant,passive,3,1,(of an animal) having normal physical functions suspended or slowed down for a period of time; in or as if in a deep sleep.,The long-dormant volcano has recently shown signs of erupting.,0,0
Inert,passive,3,1,Lacking the ability or strength to move.,The inert figure of a man could be seen lying in the front of the car.,0,0
Lackadaisical,passive,3,1,Lacking enthusiasm and determination; carelessly lazy.,The food was nice enough but the service somewhat lackadaisical.,0,0
Powerless,passive,3,1,"Without ability, influence, or power.",The villagers are powerless against the armed invaders.,0,0
Static,passive,3,1,"Lacking in movement, action, or change, especially in an undesirable or uninteresting way.",Oil prices have remained static for the last few months.,0,0
Difference,change,3,1,A point or way in which people or things are dissimilar.,What's the difference between an ape and a monkey ?,0,0
Evolution,change,3,1,The process by which different kinds of living organism are believed to have developed.,Darwin's theory of evolution,0,0
Flection,change,3,1,"The action of bending or the condition of being bent, especially the bending of a limb or joint.","It exhibits, also, something of that new growth which was to compensate for the loss of flection.",0,0
Variation,change,3,1,"A change or slight difference in condition, amount, or level, typically within certain limits.",Unemployment rates among white-collar workers show much less regional variation than corresponding blue-collar.,0,0
Alteration,change,3,1,The action or process of altering or being altered.,We've had to alter some of our plans.,0,0
Fluctuation,change,3,1,An irregular rising and falling in number or amount; a variation.,Vegetable prices fluctuate the season.,0,0
Mutation,change,3,1,The action or process of mutating.,It is well known that radiation can cause mutation.,0,0
Distort,change,3,1,Pull or twist out of shape.,The map distorted Greenland to appear four times its actual size.,0,0
Divert,change,3,1,Cause (someone or something) to change course or turn from one direction to another.,Traffic will be diverted through the side streets while the main road is resurfaced.,0,0
Juggle,change,3,1,Continuously toss into the air and catch (a number of objects) so as to keep at least one in the air while handling the others.,We all watched in amazement as he juggled with three flaming torches.,0,0
Readjust,change,3,1,Set or adjust (something) again.,"After living abroad for so long, he found it difficult to readjust to life at home.",0,0
Embolden,inspire,3,2,Give (someone) the courage or confidence to do something.,"Emboldened by drink, he walked over to speak to her.",0,0
Enthuse,inspire,3,2,"Express eager enjoyment, interest, or approval regarding something.",He was enthusing over a wonderful restaurant he'd been to.,0,0
Infuse,inspire,3,2,Fill; pervade.,The pulling down of the Berlin Wall infused the world with optimism.,0,0
Instill,inspire,3,2,Gradually but firmly establish (an idea or attitude) in a person's mind.,My parents instilled in me a love of reading.,0,0
Reassure,inspire,3,2,Say or do something to remove the doubts or fears of (someone),"I was nervous on my first day at college, but I was reassured to see some friendly faces.",0,0
Stimulate,inspire,3,2,Raise levels of physiological or nervous activity in (the body or any biological system),The government plans to cut taxes in order to stimulate the economy.,0,0
Domination,inspire,3,2,"The exercise of power or influence over someone or something, or the state of being so controlled.",He refuses to let others speak and dominates every meeting.,0,0
Origin,inspire,3,2,"The point or place where something begins, arises, or is derived.",It's a book about the origin of the universe.,0,0
Persuade,inspire,3,2,Induce (someone) to do something through reasoning or argument.,"If she doesn't want to go, nothing you can say will persuade her.",0,0
Benevolence,generosity,3,2,The quality of being well meaning; kindness.,He was a benevolent old man and wouldn't hurt a fly.,0,0
Benison,generosity,3,2,A blessing.,"If you can find blessedness, my benison is that I can see you will be happy in faraway country.",0,0
Courtesy,generosity,3,2,The showing of politeness in one's attitude and behaviour towards others.,You might get along better with your parents if you showed them some courtesy.,0,0
Hospitality,generosity,3,2,"The friendly and generous reception and entertainment of guests, visitors, or strangers.",The local people showed me great hospitality.,0,0
Philanthropy,generosity,3,2,"The desire to promote the welfare of others, expressed especially by the generous donation of money to good causes.",He argues that corporate philanthropy transforms the culture of the firm concerned.,0,0
Encourage,restore,3,2,"Give support, confidence, or hope to (someone)",We were encouraged to learn foreign languages at school.,0,0
Invigorate,restore,3,2,Give strength or energy to.,We were invigorated by our walk.,0,0
Modernize,restore,3,2,"Adapt (something) to modern needs or habits, typically by installing modern equipment or adopting modern ideas or methods.",Much of the house has been modernized.,0,0
Reclaim,restore,3,2,"Retrieve or recover (something previously lost, given, or paid); obtain the return of.",You'll be able to reclaim the tax on all equipment that you buy.,0,0
Reconstruct,restore,3,2,Build or form (something) again after it has been damaged or destroyed.,The post-war government had the enormous task of reconstructing the city.,0,0
Recover,restore,3,2,"Return to a normal state of health, mind, or strength.",It took her a long time to recover from/after her heart operation.,0,0
Reestablish,restore,3,2,Establish (something) again or anew.,Our new digital camera range has helped us re-establish our position in this important market.,0,0
Reform,restore,3,2,"Make changes in (something, especially an institution or practice) in order to improve it.",Who will reform our unfair electoral system ?,0,0
Rehabilitate,restore,3,2,"Restore (someone) to health or normal life by training and therapy after imprisonment, addiction, or illness.",The prison service should try to rehabilitate prisoners so that they can lead normal lives when they leave.,0,0
Reimburse,restore,3,2,Repay (a person who has spent or lost money),The airline reimbursed me for the amount they had overcharged me.,0,0
Reinstate,restore,3,2,Restore (someone or something) to their former position or state.,"A month after being unfairly dismissed, he was reinstated in his job.",0,0
Rejuvenate,restore,3,2,"Make (someone or something) look or feel better, younger, or more vital.",She felt rejuvenated by her fortnight in the Bahamas.,0,0
Remodel,restore,3,2,"Change the structure or form of (something, especially a building)",We've completely remodelled the kitchen.,0,0
Renovate,restore,3,2,"Restore (something old, especially a building) to a good state of repair.",He renovates old houses and sells them at a profit.,0,0
Replenish,restore,3,2,Fill (something) up again.,Food stocks were replenished by/with imports from abroad.,0,0
Reseat,restore,3,2,Cause (someone) to sit down again after they have risen.,"After you install the new floor, you will need to remove the old wax seal under the toilet, install a new wax seal, and reseat the toilet.",0,0
resuscitate,restore,3,2,Revive (someone) from unconsciousness or apparent death.,"Her heart had stopped, but the doctors successfully resuscitated her.",0,0
Retrieve,restore,3,2,Get or bring (something) back from somewhere.,We taught our dog to retrieve a ball.,0,0
Rebuild,restore,3,2,Build (something) again after it has been damaged or destroyed.,The cathedral was completely rebuilt in 1425 after it had been destroyed by fire.,0,0
Salvage,restore,3,2,Rescue (a wrecked or disabled ship or its cargo) from loss at sea.,gold coins salvaged from a shipwreck,0,0
Abdicate,deny,3,3,(of a monarch) renounce one's throne.,King Edward VIII abdicated (the British throne ) in 1936.,0,0
Abstain,deny,3,3,Restrain oneself from doing or enjoying something.,He took a vow to abstain from alcohol / smoking sex.,0,0
Cede,deny,3,3,Give up (power or territory),Hong Kong was ceded to Britain after the Opium War.,0,0
Discard,deny,3,3,Get rid of (someone or something) as no longer useful or desirable.,Discarded food containers and bottles littered the streets.,0,0
Disown,deny,3,3,Refuse to acknowledge or maintain any connection with.,It's a story set in the last century about a girl whose parents disowned her when she married a foreigner.,0,0
Eschew,deny,3,3,Deliberately avoid using; abstain from.,We won't have discussions with this group unless they eschew.,0,0
Forego,deny,3,3,Precede in place or time.,If she doesn't handle herself correctly she will forego any chance of holding a national office in the future.,0,0
Forgo,deny,3,3,Go without (something desirable),I shall have to forgo seeing you this week.,0,0
Forswear,deny,3,3,Agree to give up or do without.,to forswear all violence,0,0
Recant,deny,3,3,"Say that one no longer holds an opinion or belief, especially one considered heretical.","After a year spent in solitary confinement, he publicly recanted (his views ).",0,0
Relinquish,deny,3,3,Voluntarily cease to keep or claim; give up.,He has relinquished his claim to the throne.,0,0
Repudiate,deny,3,3,Refuse to accept; reject.,He repudiated the allegation / charge claim that he had tried to deceive them.,0,0
Retract,deny,3,3,Draw or be drawn back or back in.,retract an invitation / confession promise,0,0
Revoke,deny,3,3,"Officially cancel (a decree, decision, or promise)",The authorities have revoked their original decision to allow development of this rural area.,0,0
Vacate,deny,3,3,Leave (a place that one previously occupied),Hotel guests are requested to vacate their rooms by noon.,0,0
Waive,deny,3,3,Refrain from insisting on or using (a right or claim),"The bank manager waived the charge, as we were old and valued customers.",0,0
Disapprove,deny,3,3,Have or express an unfavourable opinion.,"The survey showed that 32 percent of respondents approve, 54 disapprove, and the rest are undecided.",0,0
Embargo,deny,3,3,An official ban on trade or other commercial activity with a particular country.,They have put an embargo on imports of clothing.,0,0
Injunction,deny,3,3,An authoritative warning or order.,The court has issued an injunction to prevent the airline from increasing its prices.,0,0
Refusal,deny,3,3,An act of refusing to do something.,Our request for permission to travel a refusal from the authorities.,0,0
Veto,deny,3,3,A constitutional right to reject a decision or proposal made by a lawmaking body.,The president has the veto over any bill that comes across his desk.,0,0
Disallow,deny,3,3,Refuse to declare valid.,All protests have been disallowed in the city.,0,0
Accomplish,achieve,3,3,Achieve or complete successfully.,The students accomplished the task in less than ten minutes.,0,0
Enact,achieve,3,3,Make (a bill or other proposal) law.,A package of economic sanctions is to be enacted against the country.,0,0
Operate,achieve,3,3,"(of a person) control the functioning of (a machine, process, or system)",How do you operate the remote control unit ?,0,0
Accumulate,achieve,3,3,Gather together or acquire an increasing number or quantity of.,"As people accumulate more wealth, they tend to spend a greater proportion of their incomes.",0,0
Acquisition,achieve,3,3,"An asset or object bought or obtained, typically by a library or museum.",The acquisition of huge amounts of data has helped our research enormously.,0,0
Benefit,achieve,3,3,An advantage or profit gained from something.,The discovery of oil brought many benefits to the town.,0,0
Perform,achieve,3,3,"Carry out, accomplish, or fulfil (an action, task, or function)",Computers can perform a variety of tasks.,0,0
Accept,get,3,3,Consent to receive or undertake (something offered),Do you accept credit cards ?,0,0
Acquire,get,3,3,Buy or obtain (an asset or object) for oneself.,He acquired the firm in 2008.,0,0
Came,get,3,3,"Each of a number of strips forming a framework for enclosing a pane of glass, especially in a leaded window.",,0,0
Garrote,get,3,3,"Kill (someone) by strangulation, especially with a length of wire or cord.",,0,0
Proceed,get,3,3,Begin a course of action.,His lawyers have decided not to proceed with the case.,0,0
Succeed,get,3,3,Achieve the desired aim or result.,She's been trying to pass her driving test for six years and she's finally succeeded.,0,0
Isolate,remove,4,1,Cause (a person or place) to be or remain alone or apart from others.,A high wall isolated the house from the rest of the village.,0,0
Oust,remove,4,1,Drive out or expel (someone) from a position or place.,The president was ousted ( ) in a military coup in January 1987,0,0
Transplant,remove,4,1,Move or transfer (someone or something) to another place or situation.,"The plants should be grown indoors until spring, when they can be transplanted outside.",0,0
Eradicate,remove,4,1,Destroy completely; put an end to.,The government claims to be doing all it can to eradicate corruption.,0,0
Amputate,remove,4,1,Cut off (a limb) by surgical operation.,They had to amputate his foot to free him from the wreckage.,0,0
Boycott,remove,4,1,"Withdraw from commercial or social relations with (a country, organization, or person) as a punishment or protest.",People were urged to boycott the country's products.,0,0
Disconnect,remove,4,1,Break the connection of or between.,Never try to fix a broken machine without disconnecting it from the electricity supply.,0,0
Terminate,remove,4,1,Bring to an end.,They terminated my contract in October.,0,0
Eliminate,remove,4,1,Completely remove or get rid of (something),A move towards healthy eating could help eliminate heart disease.,0,0
Disappear,remove,4,1,Cease to be visible.,The search was called off for the sailors who disappeared in the storm.,0,0
Extradite,remove,4,1,Hand over (a person accused or convicted of a crime) to the jurisdiction of the foreign state in which the crime was committed.,He will be extradited to Arizona from Florida.,0,0
Liberate,remove,4,1,"Set (someone) free from imprisonment, slavery, or oppression.",They said they sent troops in to liberate the people /the country from a dictator.,0,0
Disparage,remove,4,1,Regard or represent as being of little worth.,The actor's work for charity has recently been disparaged in the press as an attempt to get publicity.,0,0
Dispel,remove,4,1,"Make (a doubt, feeling, or belief) disappear.",I'd like to start the speech by dispelling a few rumours that have been spreading recently.,0,0
Eject,remove,4,1,Force or throw (something) out in a violent or sudden way.,A number of fans had been ejected from the bar for causing trouble.,0,0
Evict,remove,4,1,"Expel (someone) from a property, especially with the support of the law.",Tenants who fall behind in their rent risk being evicted.,0,0
Exonerate,remove,4,1,(of an official body) absolve (someone) from blame for a fault or wrongdoing.,The report exonerated the crew from all responsibility for the collision.,0,0
Cull,remove,4,1,Reduce the population of (a wild animal) by selective slaughter.,The plan to cull large numbers of baby seals has angered environmental groups.,0,0
Distill,remove,4,1,"Purify (a liquid) by heating it so that it vaporizes, then cooling and condensing the vapour and collecting the resulting liquid.",distilled water / whiskey,0,0
Elicit,remove,4,1,"Evoke or draw out (a reaction, answer, or fact) from someone.",Have you managed to elicit a response from them yet ?,0,0
Extort,remove,4,1,"Obtain (something) by force, threats, or other unfair means.",He had been extorting money from the old lady for years.,0,0
Extricate,remove,4,1,Free (someone or something) from a constraint or difficulty.,It took hours to extricate the car from the sand.,0,0
Wrest,remove,4,1,Forcibly pull (something) from a person's grasp.,The shareholders are planning to wrest control of the company (away) from the current directors.,0,0
Avert,remove,4,1,Turn away (one's eyes or thoughts),to avert a crisis / conflict strike famine,0,0
Disqualify,remove,4,1,"Declare (someone) ineligible for an office, activity, or competition because of an offence or infringement.",Two top athletes have been disqualified from the championship after positive drug tests.,0,0
Foreclose,remove,4,1,Take possession of a mortgaged property when the mortgagor fails to keep up their mortgage payments.,The bank is threatening to foreclose on the family's house.,0,0
Forfend,remove,4,1,Avert or prevent (something evil or unpleasant),"Is it not rather the blind brute instinct of self-protection, forfend what may?",0,0
Obviate,remove,4,1,Remove (a need or difficulty),A peaceful solution would obviate the need to send a UN military force.,0,0
Agile,buoyant,4,1,Able to move quickly and easily.,Monkeys are very agile climbers.,0,0
Ebullient,buoyant,4,1,Cheerful and full of energy.,He wasn't his usual ebullient self.,0,0
Festal,buoyant,4,1,Relating to or characteristic of a celebration or festival.,The whole town is in a festal mood.,0,0
Insuppressible,buoyant,4,1,"Incapable of being suppressed, overcome, or muffled",The insuppressible alertness and enterprise of his own mind tells upon his portrayal of these intense moments.,0,0
Irrepressible,buoyant,4,1,Not able to be controlled or restrained.,Even the rain failed to dampen his irrepressible spirits.,0,0
Jovial,buoyant,4,1,Cheerful and friendly.,He seemed a very jovial guy.,0,0
resilient,buoyant,4,1,(of a person or animal) able to withstand or recover quickly from difficult conditions.,She's a resilient girl - she won't be unhappy for long.,0,0
Sanguine,buoyant,4,1,"Optimistic or positive, especially in an apparently bad or difficult situation.",They are less sanguine about the prospects for peace.,0,0
Volatile,buoyant,4,1,(of a substance) easily evaporated at normal temperatures.,Food and fuel prices are very volatile in a war situation.,0,0
Baritone,fantastic,4,2,An adult male singing voice between tenor and bass.,"He sang in a deep, rich baritone.",0,0
Memorable,fantastic,4,2,"Worth remembering or easily remembered, especially because of being special or unusual.",a memorable performance,0,0
Potent,fantastic,4,2,"Having great power, influence, or effect.",Surprise remains the terrorists  most potent weapon.,0,0
Imaginary,fantastic,4,2,Existing only in the imagination.,As a child I had an imaginary friend.,0,0
Phenomenal,fantastic,4,2,"Remarkable or exceptional, especially exceptionally good.",Her rise to fame was quite phenomenal - in less than two years she was a household name.,0,0
Prodigious,fantastic,4,2,"Remarkably or impressively great in extent, size, or degree.",She wrote a truly prodigious number of novels.,0,0
Transcendent,fantastic,4,2,Beyond or above the range of normal or physical human experience.,transcendent power / beauty love,0,0
Tremendous,fantastic,4,2,"Very great in amount, scale, or intensity.",They were making a tremendous amount of noise last night.,0,0
Concede,grant,4,2,Admit or agree that something is true after first denying or resisting it.,The government has conceded (that) the new tax policy has been a disaster.,0,0
Concession,grant,4,2,"A thing that is granted, especially in response to demands.",Both sides involved in the conflict made some concessions in yesterday's talks.,0,0
Contribution,grant,4,2,A gift or payment to a common fund or collection.,"All contributions, no matter how small, will be much appreciated.",0,0
